{
  "schema": "raf.operational-gap-topology.v1",
  "version": "1.0.0",
  "repository": "rafaelmeloreisnovo/RafPolimata",
  "observed_commit": "37adbf091f57dbd83460336010e877c3b42382df",
  "state_model": {
    "unknown_state": "TOKEN_VAZIO",
    "claim_rule": "TOKEN_VAZIO, PENDING and FAIL never authorize an external claim.",
    "evidence_rule": "A claim may only be promoted inside the scope demonstrated by same-commit or explicitly historical evidence."
  },
  "standards_snapshot": [
    {"id": "NIST-CSF", "version": "2.0", "status": "CURRENT_FINAL", "use": "REFERENCE_ONLY_NO_CERTIFICATION_CLAIM"},
    {"id": "NIST-SSDF", "version": "1.1", "status": "CURRENT_FINAL", "use": "REFERENCE_ONLY_NO_CERTIFICATION_CLAIM"},
    {"id": "NIST-SSDF", "version": "1.2-draft", "status": "DRAFT_MONITOR_ONLY", "use": "REFERENCE_ONLY_NO_CERTIFICATION_CLAIM"},
    {"id": "SLSA", "version": "1.2", "status": "CURRENT_FINAL", "use": "REFERENCE_ONLY_NO_CERTIFICATION_CLAIM"},
    {"id": "ISO-IEC-27001", "version": "2022", "status": "CURRENT_FINAL", "use": "REFERENCE_ONLY_NO_CERTIFICATION_CLAIM"},
    {"id": "ISO-37301", "version": "2021", "status": "CURRENT_FINAL", "use": "REFERENCE_ONLY_NO_CERTIFICATION_CLAIM"},
    {"id": "ISO-31000", "version": "2018", "status": "CURRENT_FINAL", "use": "REFERENCE_ONLY_NO_CERTIFICATION_CLAIM"},
    {"id": "ISO-9001", "version": "2015+Amd1:2024", "status": "CURRENT_PENDING_REPLACEMENT", "use": "REFERENCE_ONLY_NO_CERTIFICATION_CLAIM"}
  ],
  "gaps": [
    {
      "id": "GAP-TECH-ARM64-APK-L4",
      "title": "ARM64 ELF identity inside the current APK",
      "domain": "technical",
      "state": "TOKEN_VAZIO",
      "urgency": "P0",
      "impact": "CRITICAL",
      "uncertainty_class": "OBSERVATION_MISSING",
      "claim_allowed": false,
      "owner_role": "apkc-maintainer",
      "required_roles": ["apkc-maintainer", "evidence-custodian", "quality-assurance"],
      "provenance": ["docs/APKC_VALUE_AND_GAPS.md", "docs/LACUNAS_PROFUNDAS_MVP_PRODUTO.md", "pull/299"],
      "evidence": ["CI validates structural ARM64 routes but does not prove current ELF identity inside an installed APK"],
      "next_action": "Generate one current-commit APK containing the ARM64 ELF, extract it independently and compare cryptographic identity.",
      "reference_controls": ["NIST-SSDF-PS", "SLSA-1.2-Build"],
      "closure": {
        "condition": "The ARM64 ELF embedded in the current APK is independently extracted and hash-identical to the current build artifact.",
        "required_artifacts": ["current APK", "current ARM64 ELF", "embedded ELF extraction", "SHA-256 receipt"],
        "required_gates": ["readelf on embedded ELF", "hash equality", "same-commit provenance"]
      }
    },
    {
      "id": "GAP-TECH-ANDROID-RUNTIME-L2",
      "title": "Physical Android install, launch and runtime receipt for the current artifact",
      "domain": "technical",
      "state": "TOKEN_VAZIO",
      "urgency": "P0",
      "impact": "CRITICAL",
      "uncertainty_class": "OBSERVATION_MISSING",
      "claim_allowed": false,
      "owner_role": "runtime-maintainer",
      "required_roles": ["runtime-maintainer", "apkc-maintainer", "evidence-custodian", "quality-assurance"],
      "provenance": ["AGENTS.md", "docs/AGENTES.md", "docs/APKC_VALUE_AND_GAPS.md", "pull/299"],
      "evidence": ["PR and main CI are green; device runtime remains outside those gates"],
      "next_action": "Install the same current APK on an authorized Android device, launch/dlopen it and record logcat/exit with artifact hashes.",
      "reference_controls": ["NIST-SSDF-PW", "NIST-CSF-2.0-DE", "NIST-CSF-2.0-RS"],
      "closure": {
        "condition": "Same-commit APK is installed and launched on an authorized device with a bounded runtime receipt and no unaccounted crash.",
        "required_artifacts": ["device identity without secrets", "APK SHA-256", "install receipt", "launch receipt", "logcat or exit receipt"],
        "required_gates": ["adb install or equivalent authorized install", "launch/dlopen", "runtime observation", "receipt hash binding"]
      }
    },
    {
      "id": "GAP-LEGAL-LICENSE-DECISION",
      "title": "Repository licensing and third-party redistribution decision",
      "domain": "legal",
      "state": "TOKEN_VAZIO",
      "urgency": "P0",
      "impact": "CRITICAL",
      "uncertainty_class": "OWNER_DECISION",
      "claim_allowed": false,
      "owner_role": "human-authorizer",
      "required_roles": ["human-authorizer", "security-license", "documentation-governance"],
      "provenance": ["repository metadata: license=null observed 2026-08-16", "docs/LICENCAS_COMPARADAS.md", "docs/LICENSE_DECISION_RECORD.md"],
      "evidence": [],
      "next_action": "Human owner selects the intended licensing model after authorship and third-party compatibility review; then add the corresponding root license and notices.",
      "owner_decision_required": true,
      "reference_controls": ["ISO-37301", "ISO-31000"],
      "closure": {
        "condition": "A human-authorized license decision is recorded and repository/third-party terms are made internally consistent.",
        "required_artifacts": ["license decision record", "root license text or explicit proprietary terms", "third-party license inventory"],
        "required_gates": ["owner approval", "third-party compatibility review", "GitHub license detection or explicit documented exception"]
      }
    },
    {
      "id": "GAP-SEC-PRIVATE-REPORTING",
      "title": "Verified private vulnerability reporting channel",
      "domain": "security",
      "state": "PENDING",
      "urgency": "P1",
      "impact": "HIGH",
      "uncertainty_class": "EXTERNAL_VERIFICATION",
      "claim_allowed": false,
      "owner_role": "security-license",
      "required_roles": ["security-license", "repository-maintainer"],
      "provenance": [".github/SECURITY.md", "GitHub private vulnerability reporting setting is not readable by the current integration"],
      "evidence": ["Security policy is versioned; private reporting enablement remains unverified"],
      "next_action": "Enable or verify GitHub private vulnerability reporting and record a non-sensitive administrative receipt.",
      "reference_controls": ["NIST-SSDF-RV", "NIST-CSF-2.0-RS", "ISO-IEC-27001-2022"],
      "closure": {
        "condition": "A private vulnerability intake path is demonstrably available and its handling workflow is documented.",
        "required_artifacts": ["SECURITY.md", "private reporting setting receipt or approved private contact mechanism"],
        "required_gates": ["private intake availability", "responsible disclosure workflow review"]
      }
    },
    {
      "id": "GAP-SEC-SBOM-PROVENANCE",
      "title": "Release-grade SBOM and third-party license inventory",
      "domain": "security",
      "state": "TOKEN_VAZIO",
      "urgency": "P1",
      "impact": "HIGH",
      "uncertainty_class": "IMPLEMENTATION_GAP",
      "claim_allowed": false,
      "owner_role": "security-license",
      "required_roles": ["security-license", "evidence-custodian", "release-manager"],
      "provenance": ["docs/LICENCAS_COMPARADAS.md", "release V1.0.0 has no attached assets"],
      "evidence": [],
      "next_action": "Generate a deterministic machine-readable SBOM plus third-party notices for a named release artifact and bind both to its commit/hash.",
      "reference_controls": ["NIST-SSDF-PS", "SLSA-1.2", "ISO-37301"],
      "closure": {
        "condition": "Named release artifact has reproducible SBOM, third-party inventory and provenance bound to the same commit.",
        "required_artifacts": ["SBOM", "third-party notices", "artifact manifest", "hash receipt"],
        "required_gates": ["deterministic regeneration", "license inventory review", "artifact-to-SBOM binding"]
      }
    },
    {
      "id": "GAP-GOV-CUSTODY-ISSUE121",
      "title": "Internal custody ledger cross-environment closure and issue reconciliation",
      "domain": "governance",
      "state": "PENDING",
      "urgency": "P1",
      "impact": "HIGH",
      "uncertainty_class": "EXTERNAL_VERIFICATION",
      "claim_allowed": false,
      "owner_role": "evidence-custodian",
      "required_roles": ["evidence-custodian", "ci-governance", "quality-assurance"],
      "provenance": ["issue/121", "schemas/internal_custody_event.schema.json", ".github/workflows/internal-custody-ledger.yml"],
      "evidence": ["Schema and CI ledger checks exist; issue remains open and Termux execution is still a named acceptance item"],
      "next_action": "Run the current ledger writer/verifier on Termux, preserve the receipt, reconcile each issue #121 checkbox and close only if all acceptance conditions are evidenced.",
      "reference_controls": ["NIST-SSDF-PO", "SLSA-1.2-Provenance", "ISO-31000"],
      "closure": {
        "condition": "Current writer/verifier passes both Linux CI and Termux with tamper-negative tests, and issue #121 is reconciled against receipts.",
        "required_artifacts": ["Linux CI receipt", "Termux receipt", "tamper-negative receipt", "issue reconciliation record"],
        "required_gates": ["chain verification", "tamper rejection", "cross-environment replay", "human issue reconciliation"]
      }
    },
    {
      "id": "GAP-FED-REAL-SIGNATURES-134",
      "title": "Real cryptographic authority signatures for federated receipts",
      "domain": "federation",
      "state": "TOKEN_VAZIO",
      "urgency": "P1",
      "impact": "HIGH",
      "uncertainty_class": "IMPLEMENTATION_GAP",
      "claim_allowed": false,
      "owner_role": "federation-maintainer",
      "required_roles": ["federation-maintainer", "security-license", "evidence-custodian"],
      "provenance": ["issue/134", "RafPolimata #293 referenced by issue/134"],
      "evidence": ["Issue #134 explicitly records ED25519 as TOKEN_VAZIO_PLACEHOLDER"],